series,episode,bakers,baker_age,technical,result,baker_occupation,hometown,signature_bake,show_stopper
1,1,Annetha,30,2,IN,Midwife,Essex,Light Jamaican Black Cakewith Strawberries and Cream,"Red, White & Blue Chocolate Cake with Cigarellos, Fresh Fruit, and Cream"
1,1,David,31,3,IN,Entrepreneur,Milton Keynes,Chocolate Orange Cake,"Black Forest Floor Gateauxwith Moulded Chocolate Leaves, Fallen Fruitand Chocolate Mushrooms Moulded from eggs"
1,1,Edd,24,1,IN,Debt collector for Yorkshire Bank,Bradford,Caramel Cinnamon and Banana Cake,N/A
1,1,Jonathan,25,9,IN,Research Analyst,St Albans,Carrot Cake with Lime and Cream Cheese Icing,Three Tiered White and Dark Chocolate with Almond and Cherry
1,1,Miranda,37,8,IN,Food buyer for Marks & Spencer,"Midhurst, West Sussex","Triple Layered Brownie Meringue Cake
with Raspberry Cream",Three Tiered Chocolate Fudge Cake  with Handmade Chocolate Button Decorations
1,1,Lea,51,10,OUT,Retired,"Midlothian, Scotland",Cranberry and Pistachio Cakewith Orange Flower Water Icing,Raspberries and Cream filled Chocolatewith Chocolate-dipped Fresh Fruit
1,2,David,31,8,IN,Entrepreneur,Milton Keynes,Cheddar Cheese and Fresh Rosemary Biscuits,Choux Pastry Swans  Chocolate Profiteroles
1,2,Edd,24,6,IN,Debt collector for Yorkshire Bank,Bradford,Oatmeal Raisin Cookie,Pink Macarons
1,2,Jasminder,45,2,IN,Assistant Credit Control Manager,Birmingham,Millionaires' Shortbread,Meringues with Chocolate and Space DustCoffee flavoured Eclairs
1,2,Jonathan,25,1,IN,Research Analyst,St Albans,Honey and Candied Ginger Cookies,Meringues with Whiskey Cream
1,2,Miranda,37,3,IN,Food buyer for Marks & Spencer,"Midhurst, West Sussex",Fresh Vanilla Biscuits with Royal Icing,Pistachio Macarons
1,2,Ruth,31,5,IN,Retail manager/Housewife,"Poynton, Cheshire",Peanut Shortbread withSalted Peanut Caramel,Almond Macaron with Violet ButtercreamRaspberries and Cream Eclairs
1,2,Annetha,30,7,OUT,Midwife,Essex,Rose Petal Shortbread,Pink Swirl Macarons / Eclairs
1,2,Louise,44,4,OUT,Police Officer,Manchester,Stained Glass Window Shortbread,"Strawberry, Mint, and Cream Meringues  Chocolate Eclairs / Orange, Yellow and Pink Macarons"
1,3,David,31,4,IN,Entrepreneur,Milton Keynes,Chilli Bread,"Walnut and Seed Roll
Red Berry and Almond Bun"
1,3,Edd,24,1,IN,Debt collector for Yorkshire Bank,Bradford,Olive Bread,Tomato and Mozzarella
1,3,Jasminder,45,5,IN,Assistant Credit Control Manager,Birmingham,Focaccia,"Mango and Sultana Buns
Pan au Chocolat with Mars Bars
Tutti Frutti Wheel with Jelly Tots"
1,3,Miranda,37,3,IN,Food buyer for Marks & Spencer,"Midhurst, West Sussex",Walnut and Apricot Bread,"Lemon Iced Buns
Chocolate and Orange Buns"
1,3,Ruth,31,2,IN,Retail manager/Housewife,"Poynton, Cheshire",Maple and Pecan Bread,"Chocolate and Orange Panettone
Cranberry Bagels"
1,3,Jonathan,25,6,OUT,Research Analyst,St Albans,"Anchovy, Sweet Paprika and Oregano Bread","Sticky Lemon Honey Bun
Olive and Anchovy Roll
Sundried Tomatoes and Fresh Herbs Roll
Stilton, Walnut and Apple Roll
Cinnamon and Cardamom Chelsea Bun"
1,4,Edd,24,3,IN,Debt collector for Yorkshire Bank,Bradford,Apple and Plum Pudding,"Apple and Cinnamon Crumble, Nutella Banana Brioche Bread Pudding, Rhubarb and Strawberry Suet Layer"
1,4,Jasminder,45,2,IN,Assistant Credit Control Manager,Birmingham,Sticky Toffee Pudding with Tropical Fruit & Toffee Sauce,"Bread & Butter Pudding, Treacle Suet Pudding with Fresh Fruit, Apple and Pineapple Crumble"
1,4,Miranda,37,1,IN,Food buyer for Marks & Spencer,"Midhurst, West Sussex",Sticky Toffee Pudding,"Queen of Puddings, Chocolate Pear Roly Poly, Strawberry and Rhubarb Crumble"
1,4,Ruth,31,4,IN,Retail manager/Housewife,"Poynton, Cheshire",Peach and Blueberry Boy Bait,"Apple & Ginger Crumble, Rhubarb Suet Crust, Cherry Queen of Puddings"
1,4,David,31,5,OUT,Entrepreneur,Milton Keynes,Pear and Walnut Pudding,"Apple and Blackberry Crumble, Rhubarb and Orange Betty, Suet Pear"
1,5,Edd,24,2,IN,Debt collector for Yorkshire Bank,Bradford,"Chicken, Ham, Leek and Tarragon Pie","Almond Sweet Pastry with Ginger and Chocolate  Raspberry Tart / Yorkshire Curd Tart  Chickpea and Salami, Red and Yellow Pepper, Asparagus Gruyere Quiche Canapés"
1,5,Miranda,37,1,IN,Food buyer for Marks & Spencer,"Midhurst, West Sussex","Summery Salmon, Cod and Prawn Fish Pie","Chocolate Pastry filled with Orange Cheesecake  Chocolate Pastry filled with Milk Chocolate Ganche  Strawberry Tart with Red Currant Glaze  Cheesy Crab, Broad Bean and Tomato, Pancetta Risotto Canapés"
1,5,Ruth,31,3,IN,Retail manager/Housewife,"Poynton, Cheshire",Minced Beef Pie,"Raspberry and Dark Chocolate Tart  Creme Patisserie and Cherry Tart  Citrus Curd Tart with Creme Brulee top  Tomato, Asparagus Twirl Canapés"
1,5,Jasminder,45,4,OUT,Assistant Credit Control Manager,Birmingham,Chicken and Mushroom Pie,"Jaggery, Carrot, and Spiced Condensed Milk Tart  Fruit and Custard Tart  Thai Chili Red Onion, Duck in Plum Sauce, Salmon and Prawn Canapés"
2,1,Ben,31,2,IN,Graphic Designer,Northampton,Rhubarb and Custard CupcakesAfter Dinner Cupcakes,Vanilla Sponge with White Chocolate and Raspberry Buttercream
2,1,Ian,40,10,IN,Fundraiser for English Heritage,"Dunstable, Bedfordshire",Apple and Cinnamon Cupcakes,UNKNOWN
2,1,Janet,63,8,IN,Teacher of Modern Languages,"Formby, Liverpool",Raspberry and Cream Cupcakes,Chocolate Marble Cakewith Dark and White Chocolate Truffles
2,1,Jason,19,6,IN,Civil Engineering Student,Croydon,Lemon Meringue CupcakesApple and Cinnamon Cupcakes,UNKNOWN
2,1,Joanne,41,11,IN,Housewife,"Ongar, Essex",Chocolate Orange CupcakesOrange and Cardamom Cupcakes,Chocolate and Strawberry Cake
2,1,Mary-Anne,45,4,IN,Housewife,"Kidderminster, Worcestershire",Banoffee Cupcakes,Chocolate and Raspberry Opera cake
2,1,Robert,25,3,IN,Photographer,London,Blackberry and Vanilla Cupcakeswith Liquorice Frosting,Genoise Layered Mousse Cakewith Chocolate Ganache
2,1,Simon,31,9,IN,Rugby Coach,Norfolk,Guinness and Chocolate Cupcakes,Two-Tiered Chocolate Courgette Cake
2,1,Urvashi,40,7,IN,Head of Marketing,"Enfield, London",Cherry Blossom CupcakesJapanese Lime Cupcakes,UNKNOWN
2,1,Yasmin,43,5,IN,Childminder,"West Kirby, The Wirral",Cardamom and Pomegranate Cupcakes,UNKNOWN
2,1,Keith,31,12,OUT,House husband,"Arlesey, Bedfordshire",Earl Grey Cupcakes,Chocolate and Sour Cream Cake
2,1,Holly,31,1,STAR BAKER,Advertising executive,Leicester,Cherry Bakewell Inspired CupcakesGinger Cupcakes with Fig Truffle,UNKNOWN
2,2,Ben,31,1,IN,Graphic Designer,Northampton,"Chorizo, Pepper and Gruyere Quiche",Lemon Meringue Tarts
2,2,Holly,31,4,IN,Advertising executive,Leicester,Pesto Quiche,Milk Chocolate and Pistachio TartsTrifle Tarts
2,2,Ian,40,2,IN,Fundraiser for English Heritage,"Dunstable, Bedfordshire","Stilton, Spinach and New Potato Quichewith Paprika and Walnut Pastry",UNKNOWN
2,2,Janet,63,8,IN,Teacher of Modern Languages,"Formby, Liverpool",Quiche Printanière,Red Fruit TartsChocolate and Cherry Tarts
2,2,Joanne,41,10,IN,Housewife,"Ongar, Essex","Caramelised Onion, Gruyere and Thyme Quiche",Raspberry and Mascarpone Tarts with Lemon and Almond PastryHoney and Almond Tarts with Sweetcrust
2,2,Mary-Anne,45,9,IN,Housewife,"Kidderminster, Worcestershire","Roasted Cauliflower, Cheese andCaramelised Onion Quiche",Butterscotch Brulée Tarts in Pecan PastryApple Rose Tarts
2,2,Robert,25,5,IN,Photographer,London,Smoked Bacon and Kale Quiche,"Chocolate, Fennel and Ginger TartAlmond, Creme Patissiere and Poached Pear Tart"
2,2,Urvashi,40,7,IN,Head of Marketing,"Enfield, London","Crab, Coriander and Coconut Quiche",Strawberry and Basil TartsElderflower and Honeycomb Tarts
2,2,Yasmin,43,6,IN,Childminder,"West Kirby, The Wirral",Smoked Haddock and Watercress Quiche,Chocolate and Orange with Cinnamon-Orange Pastry TartsBlueberry and Hazelnut with Hazelnut Pastry Tarts
2,2,Simon,31,11,OUT,Rugby Coach,Norfolk,Smoked Haddock and Watercress Quiche,"Passion Fruit and Ricotta TartsSalted Chocolate, Stem Ginger and Mascarpone Cream Tarts"
2,2,Jason,19,3,STAR BAKER,Civil Engineering Student,Croydon,Salmon and Pak Choi Quiche,Mint Chocolate Tarts Blueberry Bakewell Tarts
2,3,Ben,31,3,IN,Graphic Designer,Northampton,"Walnut, Raisin and Rosemary Loaf",UNKNOWN
2,3,Holly,31,6,IN,Advertising executive,Leicester,Picnic Loaf,Stilton and Walnut Rolls
2,3,Janet,63,8,IN,Teacher of Modern Languages,"Formby, Liverpool",Zupfe Loaf with Gruyère Cheese,Apple and Walnut Granary Rolls Red Onion Cottage Rolls
2,3,Jason,19,7,IN,Civil Engineering Student,Croydon,Cheese and Onion Tear and Share Loaf,UNKNOWN
2,3,Joanne,41,1,IN,Housewife,"Ongar, Essex","Stromboli flavored with Mozzarella, Ham, and Picante Pepper",Unknown
2,3,Mary-Anne,45,5,IN,Housewife,"Kidderminster, Worcestershire",Ploughman's Loaf,Herb and Walnut BreadsChocolate and Chilli Buns
2,3,Robert,25,4,IN,Photographer,London,Rye and Coriander Seed Loaf,Blueberry Brioche RollsLemon and Poppy Seed Rolls
2,3,Ian,40,10,OUT,Fundraiser for English Heritage,"Dunstable, Bedfordshire","Courgette, Caerphilly Cheese and Thyme Loaf",Walnut and Raisin RollsCracked Wheat Logs
2,3,Urvashi,40,9,OUT,Head of Marketing,"Enfield, London",Salt and Peppercorn Loaf,Chilli and Halloumi RollsLemon and Coriander Mini Loaves
2,3,Yasmin,43,2,STAR BAKER,Childminder,"West Kirby, The Wirral",Egyptian Dukkah Loaf with Mixed Spices,"Pesto Bread
Sweet Coconut Rolls"
2,4,Janet,63,4,IN,Teacher of Modern Languages,"Formby, Liverpool",Christmas Marzipan Biscuits,"Raspberry Macarons
Blackcurrant Macarons
Almond Macarons"
2,4,Joanne,41,8,IN,Housewife,"Ongar, Essex",Lavender Biscuits,Blueberry MacaronsCoconut MacaronsStrawberry Macarons
2,4,Mary-Anne,45,2,IN,Housewife,"Kidderminster, Worcestershire",Melting Moments,Blackcurrant and Mint MacaronsGooseberry and Elderflower MacaronsHazelnut Macarons
2,4,Robert,25,7,IN,Photographer,London,Chocolate and Ginger Oat Biscuits,Strawberry and Lime MacaronsLemon MacaronsChocolate and Cardamom Macarons
2,4,Yasmin,43,6,IN,Childminder,"West Kirby, The Wirral",Chocolate Chip and Pistachio Biscotti,Chocolate and Lime MacaronsCoffee and Walnut MacaronsPineapple and Coconut Macarons
2,4,Ben,31,5,OUT,Graphic Designer,Northampton,Stem Ginger Nuts,Chocolate and Almond MacaronsPine Nut MacaronsPistachio Macarons
2,4,Holly,31,3,STAR BAKER,Advertising executive,Leicester,Strawberry and Custard Melts,"'Chocolate bars of my youth'
(Caramel Macarons, Mint Chocolate Macarons and Chocolate Orange Macarons)"
2,4,Jason,19,1,STAR BAKER,Civil Engineering Student,Croydon,Lebkuchen,"Mocktail Macarons
(Mojito, Cranberry Cooler, and Pina Colada)"
2,5,Holly,31,4,IN,Advertising executive,Leicester,"Stilton, Potato and Caramelised Onion Pie",Lime Meringue Pie
2,5,Joanne,41,6,IN,Housewife,"Ongar, Essex",Salmon and Asparagus Pie,Apple and Raspberry Meringue Pie
2,5,Mary-Anne,45,2,IN,Housewife,"Kidderminster, Worcestershire",Chicken and Bacon Pie,Midnight Meringue
2,5,Yasmin,43,5,IN,Childminder,"West Kirby, The Wirral",Family Fish Pie,Peach and Raspberry Meringue Pie
2,5,Jason,19,7,OUT,Civil Engineering Student,Croydon,Brown Down Chicken Pie,Plum Meringue Pie
2,5,Robert,25,3,OUT,Photographer,London,Chicken and Mushroom Pie,Rhubarb and Custard Meringue Pie
2,5,Janet,63,1,STAR BAKER,Teacher of Modern Languages,"Formby, Liverpool",Chicken and Chestnut Pie,Rhubarb Meringue Pie
2,6,Holly,31,3,IN,Advertising executive,Leicester,Father Christmas' Baked Cheesecake,Hansel and Gretel's Croquembouche
2,6,Janet,63,5,IN,Teacher of Modern Languages,"Formby, Liverpool",Rhubarb and Ginger Baked Cheesecake,Orange and Nougatine Croquembouche
2,6,Mary-Anne,45,4,IN,Housewife,"Kidderminster, Worcestershire",Tutti Fruitti Curd Baked Cheesecake,Orange and Praline Croquembouche with Cardamom Caramel
2,6,Yasmin,43,2,OUT,Childminder,"West Kirby, The Wirral",Baked Amaretto Cheesecake,Rose Croquembouche
2,6,Joanne,41,1,STAR BAKER,Housewife,"Ongar, Essex",Rum and Raisin Baked Cheesecake,Limoncello and White Chocolate Croquembouche
2,7,Holly,31,1,IN,Advertising executive,Leicester,"White Chocolate, Hazelnut and Raspberry Genoise Mousse Cake","Apricot, Macadamia and White Chocolate PinwheelsAlmond CroissantsApple, Raisin and Cinnamon Plaits"
2,7,Joanne,41,3,IN,Housewife,"Ongar, Essex",Raspberry & Strawberry Mousse Cake,Pain Aux RaisinChocolate TwistsBanana and Raisin Pastries
2,7,Mary-Anne,45,2,IN,Housewife,"Kidderminster, Worcestershire",Chocolate and Orange Mousse Cake,Raspberry Rose DanishesPraline SpiralsAlsatian Plaited Danishes
2,7,Janet,63,4,OUT,Teacher of Modern Languages,"Formby, Liverpool",Chocolate Amaretto Mousse Cake,Pain Aux RaisinPlain CroissantPain Au Chocolat
2,8,Holly,31,2,Runner-up,Advertising executive,Leicester,Banoffee Inspired Mille Feuille,Strawberry and Cream Meringue NestGooseberry and Elderflower 'Bakewell' TartsNeapolitan Ice-Cream Sandwich
2,8,Mary-Anne,45,3,Runner-up,Housewife,"Kidderminster, Worcestershire",Lemon and Ginger Mille Feuille,Fruit Tarts with Elderflower CustardStrawberry and Rhubarb CheesecakesBlack Fruit Meringue with Everlasting Syllabub
2,8,Joanne,41,1,WINNER,Housewife,"Ongar, Essex",Raspberry and Blueberry Mille Feuille,"Mini Victoria SandwichesRaspberry, White Chocolate and Pistachio Mini MeringuesMini Banoffee Pie with Banana Mousse"
3,1,Brendan,63,10,IN,Recruitment consultant,Sutton Coldfield,"Plum, Sour Cherry & Walnut",UNKNOWN
3,1,Cathryn,27,5,IN,Shop assistant,"Pease Pottage, West Sussex","Apple, Hazelnut and Calvados",Hidden Cupcake Cake
3,1,Danny,45,7,IN,Intensive care consultant,Sheffield,"Plum, Ginger & Orange",UNKNOWN
3,1,James,21,2,IN,Medical student,"Hillswick, Shetland Islands","Parsnip, Pear, and Pecan","""Simmer Dim"" Sunset Cake"
3,1,John,22,11,IN,Law student,Wigan,"Toffee Apple, Orange & Cranberry",Hidden Pink Hearts Cake
3,1,Manisha,27,6,IN,Nursery nurse,Leicester,"Vanilla, Peach and Raspberry",White Chocolate Cake with a Red Velvet and White Chocolate Mousse Heart
3,1,Peter,43,3,IN,Sales manager,"Windsor, Berkshire","Pear, Muscat & Chocolate",Jubilee Cake
3,1,Ryan,38,8,IN,Photographer,Bristol,Kumquat and Orange Polenta,Hidden Flowerbed Mousse Cake
3,1,Sarah-Jane,28,1,IN,Vicar's wife,"Bewbush, West Sussex","Pear, Chocolate and Hazelnut",Hidden Crown Cake
3,1,Stuart,26,9,IN,PE teacher,"Lichfield, Staffordshire",Tomato and Ginger,Lemon and Pistachio Union Flag Cake
3,1,Natasha,36,12,OUT,Midwife,"Tamworth, Staffordshire",Pineapple & Passion Fruit,Mother's Day Layered Rose Cake
3,1,Victoria,50,4,STAR BAKER,CEO of the charity Plantlife,Somerset,Pear and Pecan,Blackbird Pie Cake
3,2,Brendan,63,4,IN,Recruitment consultant,Sutton Coldfield,Middle Eastern Taboon BreadIndian Rotis,"Chocolate and Vanilla Bagels
Cumin and Gruyere Bagels"
3,2,Cathryn,27,8,IN,Shop assistant,"Pease Pottage, West Sussex","Spiced Mango NaanLime, Coriander and Chilli Tortillas","Cranberry and Orange Bagels
Chipotle, Chili, and Smoked Cheddar Bagels"
3,2,Danny,45,3,IN,Intensive care consultant,Sheffield,Lime Coriander and Coconut TortillasZaatar Naan with Dukkah,UNKNOWN
3,2,James,21,2,IN,Medical student,"Hillswick, Shetland Islands","Tomato, Garlic, and Parmesan FlatbreadsTattie Scones","Orange, Mint and Chocolate Bagels
'Millers' Sourdough Bagels"
3,2,Manisha,27,6,IN,Nursery nurse,Leicester,Indian FlatbreadsItalian Flatbreads,UNKNOWN
3,2,Ryan,38,5,IN,Photographer,Bristol,Shanghai Spring Onion FlatbreadsGarlic and Coriander Naan,"Cinnamon and Date Bagels
Tarragon and Rosemary Bagels"
3,2,Sarah-Jane,28,10,IN,Vicar's wife,"Bewbush, West Sussex",Toasted Coconut and Lime RotisOatcakes,UNKNOWN
3,2,Stuart,26,9,IN,PE teacher,"Lichfield, Staffordshire",Bombay BreadChorizo and Spring Onion Naan,"Cinnamon and Cranberry Bagels
Tomato and Thyme Bagels"
3,2,Victoria,50,7,IN,CEO of the charity Plantlife,Somerset,Coriander and Lemon NaanGarlic and Parsnip Chapatis,"Saffron and Golden Raisin Bagels
Porcini Bagels"
3,2,Peter,43,11,OUT,Sales manager,"Windsor, Berkshire",Fennel and Nigella Seed NaanBannock Bread,"Rosemary and Sea Salt Bagels
Apple and Cinnamon Bagels"
3,2,John,22,1,STAR BAKER,Law student,Wigan,"Coriander and Chilli RotisGarlic, Pomegranate and Potato Pitas","Fig, Walnut and Gruyere Bagels
Blueberry and White Chocolate Bagels"
3,3,Brendan,63,9,IN,Recruitment consultant,Sutton Coldfield,Apple and Ginger Tarte Tatin,"Blackberry, Nectarine and Dragon Fruit Tart"
3,3,Cathryn,27,3,IN,Shop assistant,"Pease Pottage, West Sussex","Plum, Cherry and Five Spice Tarte Tatin","Raspberry, Pistachio and Lemon Tart"
3,3,Danny,45,2,IN,Intensive care consultant,Sheffield,Savoury Pear and Roquefort Tarte Tatin,"Pineapple, Coconut and Frangipane Tart"
3,3,John,22,6,IN,Law student,Wigan,Apple and Vanilla Tarte Tatin with Walnut Praline,"Berries, Grapes, Pomegranate, and Dragon Fruit Tart"
3,3,Manisha,27,10,IN,Nursery nurse,Leicester,"Cinnamon, Apple and Pear Tarte Tatin",Rum and Tropical Fruit Tart
3,3,Ryan,38,5,IN,Photographer,Bristol,Spiced Pear Tarte Tatin,UNKNOWN
3,3,Sarah-Jane,28,8,IN,Vicar's wife,"Bewbush, West Sussex",Caramelised Banana Tarte Tatin,French Apple Tart with Blackberry and Cassis Jam
3,3,Stuart,26,7,IN,PE teacher,"Lichfield, Staffordshire",Pear and Almond Tarte Tatin,Raspberry Triple Chocolate Layered Tart
3,3,Victoria,50,4,OUT,CEO of the charity Plantlife,Somerset,"Fig, Walnut and Pink Peppercorn Tarte Tatin",Tropical Fruit Tart with Black Pepper Crust
3,3,James,21,1,STAR BAKER,Medical student,"Hillswick, Shetland Islands",Apple and Lavender Tarte Tatin,"Rose, Lychee and Raspberry Fruit Tart"
3,4,Cathryn,27,3,IN,Shop assistant,"Pease Pottage, West Sussex","White Chocolate, Macadamia and Coffee Torte","Gooseberry, Almond and Honey Meringue"
3,4,Danny,45,2,IN,Intensive care consultant,Sheffield,"Blackberry, White Chocolate, Lemon and Elderflower Torte","'Monte Bianco' Chestnut, Chocolate and Coffee Dacquoise"
3,4,James,21,5,IN,Medical student,"Hillswick, Shetland Islands","Hazelnut, Chocolate and Passionfruit Torte","Fig, Chestnut, Cherry and Chocolate Layered Meringue"
3,4,John,22,6,IN,Law student,Wigan,'Torte Noir' Black Forest Torte with Boozy Cream,Elderflower and Bramble Berry Pavlova
3,4,Manisha,27,9,IN,Nursery nurse,Leicester,"Almond, Chocolate and Cherry Torte",Tiramisu Layered Meringue Dessert
3,4,Ryan,38,7,IN,Photographer,Bristol,Green Tea Opera Torte,"Strawberry, Rose and Pistachio Meringue"
3,4,Sarah-Jane,28,4,IN,Vicar's wife,"Bewbush, West Sussex",Chocolate and Almond Truffle Torte,Hazelnut Tiramisu Layered Meringue
3,4,Stuart,26,8,OUT,PE teacher,"Lichfield, Staffordshire",Black Forest Torte,Choca Blocka Mocha Meringue
3,4,Brendan,63,1,STAR BAKER,Recruitment consultant,Sutton Coldfield,Clementine and Chestnut Torte,"Pear, Chocolate and Hazelnut Dacquoise"
3,5,Brendan,63,3,IN,Recruitment consultant,Sutton Coldfield,Salmon Coulibiac in a Scandinavian Pastry,All American Chiffon Pie
3,5,Cathryn,27,1,IN,Shop assistant,"Pease Pottage, West Sussex",Full English Wellington,Chocolate and Peanut Butter Pumpkin Pie
3,5,Danny,45,7,IN,Intensive care consultant,Sheffield,"Chickpea, Spinach & Mushroom Wellington",Trick or Treat Pumpkin Pie
3,5,James,21,6,IN,Medical student,"Hillswick, Shetland Islands",Four Pig Wellington,Sweet Potato Pie
3,5,John,22,2,IN,Law student,Wigan,Venison and Haggis Wellington,Star-Spangled Pecan Pie
3,5,Sarah-Jane,28,4,IN,Vicar's wife,"Bewbush, West Sussex",Beef Wellington with Parma Ham and Gorgonzola Cheese,Chocolate and Banana Cream Pie
3,5,Manisha,27,5,OUT,Nursery nurse,Leicester,Lamb Wellington with Rosemary and Mint,Banana Scotch Pie
3,5,Ryan,38,8,STAR BAKER,Photographer,Bristol,Curry Spiced Seabass Wellington,Key Lime Pie
3,6,Cathryn,27,3,IN,Shop assistant,"Pease Pottage, West Sussex","Chocolate Walnut Whip Puddings
Elderflower Sponges",Roasted Vegetable Couscous and Sheep Cheese Strudel
3,6,Danny,45,2,IN,Intensive care consultant,Sheffield,Banoffee Puddings with Walnut Butterscotch SauceJubilee Chocolate Fondants,"Leek, Potato, Pistachio and Gruyère Strudel"
3,6,James,21,7,IN,Medical student,"Hillswick, Shetland Islands",Banana and Clove PuddingsClootie Dumplings,"Strawberry, Rhubarb and Ginger Strudel"
3,6,John,22,5,IN,Law student,Wigan,Spicy Toffee PuddingsRaspberry and White Chocolate Puddings,Did not complete due to injury
3,6,Ryan,38,6,IN,Photographer,Bristol,Chocolate FondantsSticky Ginger and Date Puddings,"Apple, Sour Cherry, Raisin and Mixed Nuts Strudel"
3,6,Sarah-Jane,28,4,IN,Vicar's wife,"Bewbush, West Sussex",Sticky Toffee PuddingsGranny's Saucy Lemon Puddings,Sweet Strudel with Sour Cherries
3,6,Brendan,63,1,STAR BAKER,Recruitment consultant,Sutton Coldfield,"Rhubarb, Strawberry and Ginger Puddings
Sticky Toffee Puddings","Spinach, Cheese and Walnut Strudel"
3,7,Brendan,63,4,IN,Recruitment consultant,Sutton Coldfield,Chelsea Bunskis,Black Forest Christmas Stollen
3,7,Cathryn,27,5,IN,Shop assistant,"Pease Pottage, West Sussex",Lady Arundel's Manchet Buns,Bonfire Night Tear 'n' Share Brioche
3,7,James,21,1,IN,Medical student,"Hillswick, Shetland Islands",Easter Chelsea Buns,Whisky Kugelhopf-Brioche Baba
3,7,John,22,3,IN,Law student,Wigan,Cherry and Almond Saffron Buns,Marzipan Stollen
3,7,Ryan,38,6,OUT,Photographer,Bristol,Lardy Cakes,Char Siu Bao
3,7,Sarah-Jane,28,7,OUT,Vicar's wife,"Bewbush, West Sussex","Orange, Nutmeg and Saffron Buns",Sour Cherry and Dark Chocolate Christmas Plait
3,7,Danny,45,2,STAR BAKER,Intensive care consultant,Sheffield,Bakewell Chelsea Buns,European Christmas Wreath
3,8,Brendan,63,2,IN,Recruitment consultant,Sutton Coldfield,Multi-Seed Savoury Crackers,Fantasy Gingerbread Bird House
3,8,Danny,45,4,IN,Intensive care consultant,Sheffield,Spiced Almond Drinks Crackers,Gingerbread Big Ben
3,8,John,22,3,IN,Law student,Wigan,Asian Spice Crackers,Gingerbread Roman Coliseum
3,8,Cathryn,27,5,OUT,Shop assistant,"Pease Pottage, West Sussex",Cheese and Pickle Crackers,Gingerbread Buckingham Palace
3,8,James,21,1,STAR BAKER,Medical student,"Hillswick, Shetland Islands","Smoky Cayenne, Cumin and Chilli Crackers",Gingerbread Barn
3,9,Brendan,63,3,IN,Recruitment consultant,Sutton Coldfield,Coffee Meringue and Hazelnut CreamsApricot and Pistachio FriandsLime Curd Choux Pastry Cygnets,Gateau St. Honoré
3,9,John,22,2,IN,Law student,Wigan,Lemon MadeleinesWhite Chocolate and Raspberry TartletsDark Chocolate and Cherry Macaroons,Gateau St. Honoré a la Passion
3,9,Danny,45,4,OUT,Intensive care consultant,Sheffield,Blackberry and Peppermint MacaroonsMiniature Raspberry and Basil FinanciersOrange and White Chocolate Langues de Chat,Rosewater and Lychee St. Honoré
3,9,James,21,1,STAR BAKER,Medical student,"Hillswick, Shetland Islands","Lemon and Rhubarb TartletsChocolate Indulgence Petits FoursChilli, Lime and Raspberry Macaroons","Coffee, Caramel and Hazelnut Paris-Brest"
3,10,Brendan,63,2,Runner-up,Recruitment consultant,Sutton Coldfield,Potato and Pepper Pithivier,Family Reunion Chiffon Cake
3,10,James,21,1,Runner-up,Medical student,"Hillswick, Shetland Islands",Spanish Pithivier with Chorizo and Red Pepper,United Chiffon Cakes
3,10,John,22,2,WINNER,Law student,Wigan,Italian Sausage and Roasted Vegetable Pithivier,Heaven and Hell Chiffon Cake
4,1,Ali,25,11,IN,Charity worker,"Saltley, Birmingham",Rose and Pistachio Cake,"Chocolate, Raspberry and Passion Fruit Engagement Cake"
4,1,Beca,31,8,IN,Military Wives' Choir Singer,"Aldershot, Hampshire",Grapefruit Sandwich Cake,Chocolate Cherry Indulgence
4,1,Christine,66,3,IN,Director of an engraving company,"Didcot, Oxfordshire","Strawberry, Vanilla and Rosewater Summer Basket",Chocolate and Orange 'Fripperous' Hat Cake
4,1,Deborah,51,9,IN,Dentist,Peterborough,Pineapple Cake,'Coffee Time'
4,1,Frances,31,7,IN,Children's Clothes Designer,"Market Harborough, Leicestershire",Giant Jam Sandwich,Secret Squirrel Cake
4,1,Glenn,37,4,IN,English Teacher,"Teignmouth, Devon",Strawberries and Cream Cake,Almond and Espresso Chocolate Cake
4,1,Howard,51,6,IN,Council Worker,Sheffield,Passion Fruit and Coconut Cake,Black Forest Revisited
4,1,Kimberley,30,10,IN,Psychologist,London,Blood Orange Cake,"Chocolate, Raspberry & Basil Layer Cake"
4,1,Lucy,38,2,IN,Horticulturist,"Grimsby, Lincolnshire",Timperley Early Cake,Thyme 'Wildwood' Cake
4,1,Mark,37,5,IN,Carpenter and Kitchen Fitter,Milton Keynes,Lemon and Poppy Seed Cake,Chocolate Monster
4,1,Ruby,20,12,IN,History of Art and Philosophy Student,"Southend, Essex",Rhubarb and Custard Sandwich Cake,Chocolate and Ginger Night Sky Cake
4,1,Toby,30,13,OUT,Web Programmer,"Reading, Berkshire",Spiced and Iced Carrot Cake,Two Tiered Chocolate Cake
4,1,Robert,54,1,STAR BAKER,Space Satellite Designer,"Melbourn, Cambridgeshire",Pecan and Apple Cake,Raspberry Chocolate Cake
4,2,Ali,25,9,IN,Charity worker,"Saltley, Birmingham",Italian Grissini,Sweet and Savoury Yin Yang Bread
4,2,Beca,31,11,IN,Military Wives' Choir Singer,"Aldershot, Hampshire",Fennel and Chilli Breadsticks,Five Strand Christmas Wreath
4,2,Christine,66,4,IN,Director of an engraving company,"Didcot, Oxfordshire",Mediterranean Breadsticks with Oregano,Double Plaited Loaf
4,2,Deborah,51,8,IN,Dentist,Peterborough,Fennel & Chilli Breadsticks,Walnut Fleur Loaf
4,2,Frances,31,2,IN,Children's Clothes Designer,"Market Harborough, Leicestershire",Giant Matchsticks,Sailor's Knot
4,2,Glenn,37,7,IN,English Teacher,"Teignmouth, Devon",Rosemary and Parmesan Grissini,Harvest Crown
4,2,Howard,51,10,IN,Council Worker,Sheffield,Moroccan Breadsticks,Picasso Sun Bread
4,2,Kimberley,30,1,IN,Psychologist,London,Nigella Seed and Parmesan Breadsticks,Peace Bread
4,2,Mark,37,6,IN,Carpenter and Kitchen Fitter,Milton Keynes,Rosemary & Raisin Breadsticks,Sage & Garlic Plait
4,2,Robert,54,5,IN,Space Satellite Designer,"Melbourn, Cambridgeshire",Twisty Rye Bread Sticks,Tribute Loaf
4,2,Lucy,38,12,OUT,Horticulturist,"Grimsby, Lincolnshire",Grissini with Salt,Roast Tomato Bread
4,2,Ruby,20,3,STAR BAKER,History of Art and Philosophy Student,"Southend, Essex",Mexican Breadsticks,White Chocolate and Orange Peacock Bread
4,3,Ali,25,5,IN,Charity worker,"Saltley, Birmingham","Coconut, Raspberry and Lemon Meringue Trifle",Vanilla Latte Mini CakesLime & Mint Shortbread Pops
