series,episode,bakers,baker_age,technical,result,baker_occupation,hometown,signature_bake,show_stopper
4,3,Beca,31,10,IN,Military Wives' Choir Singer,"Aldershot, Hampshire",Orange and Ginger Trifle,Limoncello and Blueberry BurstsMillionaire Shortbread
4,3,Frances,31,8,IN,Children's Clothes Designer,"Market Harborough, Leicestershire",Apple and Blackberry Crumble Trifle,'Ballet Bites' Ginger NutcrackersSugar Plum Fairy Cakes
4,3,Glenn,37,1,IN,English Teacher,"Teignmouth, Devon",Raspberry and Almond Trifle,Billionaire BouchéesOrange Financiers
4,3,Howard,51,7,IN,Council Worker,Sheffield,Caramel and Apple Trifle*,Black Coffee and Cardamom CakesWhite Stilton and Pear Biscuits
4,3,Kimberley,30,6,IN,Psychologist,London,"Peach, Almond and Ginger Trifle",Chocolate Pistachio FinanciersLemon Bergamot Biscuits
4,3,Robert,54,2,IN,Space Satellite Designer,"Melbourn, Cambridgeshire",Rhubarb and Orange Trifle,Almond FriandsTurǫn Macaroons
4,3,Ruby,20,3,IN,History of Art and Philosophy Student,"Southend, Essex",Desert Island Trifle,Lemon Shortbread and White Chocolate SeashellsBlackberry and Chocolate Layer Cakes
4,3,Deborah,51,9,OUT,Dentist,Peterborough,Tropical Trifle*,Canelé Cherry and Chocolate CakesRose Cookies
4,3,Mark,37,11,OUT,Carpenter and Kitchen Fitter,Milton Keynes,"Ginger, Mango and Passion Fruit Trifle",Rose and Pistachio MacaroonsChocolate and Raspberry Bites
4,3,Christine,66,4,STAR BAKER,Director of an engraving company,"Didcot, Oxfordshire",Caribbean Pina Colada Trifle,Ninety-NinersSachertorte Parcels
4,4,Beca,31,2,IN,Military Wives' Choir Singer,"Aldershot, Hampshire",Mamgu's Cherry-Apple Tart,Moroccan Vegetable Filo Feast
4,4,Christine,66,7,IN,Director of an engraving company,"Didcot, Oxfordshire","Granny Rogers' Apple, Plum & Cinnamon Country Pie",Roasted Vegetable Filo Pie with Feta Cheese
4,4,Frances,31,1,IN,Children's Clothes Designer,"Market Harborough, Leicestershire",Peach Pie In the Sky,Cherry Tree Baklava Filo Pie
4,4,Glenn,37,9,IN,English Teacher,"Teignmouth, Devon",Apple & Maple Syrup Pie,Spanakopita (Walnut and Feta Cheese)
4,4,Howard,51,5,IN,Council Worker,Sheffield,Apple Pie with Sage Pastry,Fresh Fig and Feta Filo Flan
4,4,Robert,54,3,IN,Space Satellite Designer,"Melbourn, Cambridgeshire",Apple and Pear Pie with Thyme,Spanakopita with St George's Mushrooms
4,4,Ruby,20,6,IN,History of Art and Philosophy Student,"Southend, Essex",Apple and Marzipan Pie,"Rose, Almond and Raspberry Filo Pie"
4,4,Ali,25,8,OUT,Charity worker,"Saltley, Birmingham",Apple and Ginger Pie with a Pecan and Walnut Shortcrust Pastry,"Orange, Cardamom and Date M'Hanncha"
4,4,Kimberley,30,4,STAR BAKER,Psychologist,London,Pecan and Rosemary Caramel Apple Pie,"Chicken, Bacon and Butternut Squash Pie"
4,5,Beca,31,5,IN,Military Wives' Choir Singer,"Aldershot, Hampshire","Chocolate, Cherry and Hazelnut Brownies",Tiered Macaron and Sugar Dough Biscuit Centrepiece
4,5,Frances,31,3,IN,Children's Clothes Designer,"Market Harborough, Leicestershire",Millionaire Banoffee Bonus,Biscuit Buttons and Beads
4,5,Glenn,37,2,IN,English Teacher,"Teignmouth, Devon",Apricot and Pistachio Tiffin,Shortbread and Macaron Helter-Skelter
4,5,Howard,51,8,IN,Council Worker,Sheffield,Breakfast Traybake,Japanese Pagoda Tea Tower
4,5,Kimberley,30,7,IN,Psychologist,London,Cherry and Almond Bakewell Florentine Slice,Black and White Viennese Biscuit Stack
4,5,Ruby,20,6,IN,History of Art and Philosophy Student,"Southend, Essex",Blackberry and Lemon Bakewell Slice,'Dropped Ice-Cream' Biscuit Centrepiece
4,5,Robert,54,4,OUT,Space Satellite Designer,"Melbourn, Cambridgeshire",Blueberry & Orange Traybake,Dalek
4,5,Christine,66,1,STAR BAKER,Director of an engraving company,"Didcot, Oxfordshire",Mixed Berry and Almond Crumble Traybake,Shortbread Bavarian Clock Tower
4,6,Beca,31,6,IN,Military Wives' Choir Singer,"Aldershot, Hampshire",Bara Brith,Chocolate and Rum-Soaked Prune BriochesCardamom Spiced Lemon Iced Buns
4,6,Christine,66,4,IN,Director of an engraving company,"Didcot, Oxfordshire",Oxford Nutty Fruit Loaf,Schnecken BunsVanilla Custard Skolebrød
4,6,Frances,31,2,IN,Children's Clothes Designer,"Market Harborough, Leicestershire",Chai Tea Loaf,Hot Cross BriochesRhubarb and Custard Kolaches
4,6,Glenn,37,5,IN,English Teacher,"Teignmouth, Devon",Devonshire Panettone,Almond and Apricot BriochesSticky Caramel Kanelbullen
4,6,Kimberley,30,3,IN,Psychologist,London,Chai Spiced Ginger and Date Tea Loaf,Double Chocolate and Hazelnut BriochesDanish Kanelsnurrer
4,6,Howard,51,7,OUT,Council Worker,Sheffield,Date & Hemp Yorkshire Loaf,Peachy BunsGerman Baumschnecken
4,6,Ruby,20,1,STAR BAKER,History of Art and Philosophy Student,"Southend, Essex",Citrus Tea Loaf,Twisted Swedish KanelbullarSaffron St. Lucia Buns
4,7,Beca,31,1,IN,Military Wives' Choir Singer,"Aldershot, Hampshire",Spring Lamb and Vegetable Suet Puddingwith Redcurrant Gravy,Nectarine and Frangipane SquaresChocolate and Hazelnut Vol-au-ventsStrawberries and Cream Mille-feuille
4,7,Christine,66,6,IN,Director of an engraving company,"Didcot, Oxfordshire",Spotted Dick 'With a Kick'and Vanilla Custard Ice Cream,Eccles CakesFresh Fruit BasketsLemon Cream Eton Mess Mille-feuille
4,7,Kimberley,30,4,IN,Psychologist,London,Barberry and Apple Spotted Dickwith Maple Syrup and White Chocolate Custard,"Pear, Malt and Butterscotch Mille-feuilleBlackberry and Lemon Verbena Crème Brûle Custard TartsFig, Orange and Thyme Galette"
4,7,Ruby,20,2,IN,History of Art and Philosophy Student,"Southend, Essex",Plum Jam Roly-Polywith Ginger Ice cream,Raspberry and Passion Fruit Mille-feuilleCaramelised Apple LatticePortuguese Custard Tarts
4,7,Glenn,37,3,OUT,English Teacher,"Teignmouth, Devon",Prune and Armagnac Puddingwith Boozy Butterscotch Sauce,Caramelised Apple and Marzipan TartletsChocolate Elephant EarsPassion Fruit Mille-feuille
4,7,Frances,31,5,STAR BAKER,Children's Clothes Designer,"Market Harborough, Leicestershire",Figgy Roll-y Poly Puddingwith Caramelised Walnut and Honey Ice-Cream,French Framboise Cream HornsSheet Music Mille-feuilleBass Clef Palmiers
4,8,Beca,31,4,IN,Military Wives' Choir Singer,"Aldershot, Hampshire","Potato, Spelt and Rosemary Focaccia",Spiced Butternut Squash and Pecan 'Cheese' Cake
4,8,Frances,31,3,IN,Children's Clothes Designer,"Market Harborough, Leicestershire",'Chelsea Flour Show' Bun Bouquet,"Hidden Carrot Cake (Ground Praline, Beetroot and Walnut)"
4,8,Kimberley,30,2,IN,Psychologist,London,Wild Garlic Pesto and Parma Ham Spelt Loaf,Butternut Squash and Spice Cake Toadstool House
4,8,Christine,66,5,OUT,Director of an engraving company,"Didcot, Oxfordshire","Multi-Seeded Loaf with Pumpkin, Sesame and Sunflower Seeds",Sweet Potato Guitar with Passion Fruit Icing and Marshmallow Fondant
4,8,Ruby,20,1,STAR BAKER,History of Art and Philosophy Student,"Southend, Essex",Mango and Nigella Seed Spelt Cob,Carrot Cake and Pistachio Garden Plot
4,9,Frances,31,2,IN,Children's Clothes Designer,"Market Harborough, Leicestershire","Legume Canapés:
Chantenay CarrotsChoux Pastry TomatoesCauliflower Cheese Scones",Great British Soap Opera Cake
4,9,Ruby,20,4,IN,History of Art and Philosophy Student,"Southend, Essex","Beetroot Jelly on Poppy Seed BiscuitsSpinach, Parmesan and Egg TartletsChoux Buns with Goat's Cheese and Caramelised Onions","Chocolate, Almond Praline and Saffron Opera Cake"
4,9,Beca,31,3,OUT,Military Wives' Choir Singer,"Aldershot, Hampshire",Stilton and Walnut MacaronsBeetroot and Salmon Choux PuffsWelsh Rarebit Tartlets,Banoffee Opera Cake
4,9,Kimberley,30,1,STAR BAKER,Psychologist,London,Pea Purée TartsCrab and Wasabi ProfiterolesSteamed Buns with Barbecue Chicken,Passion Fruit and Lime Opera Cake
4,10,Kimberley,30,1,Runner-up,Psychologist,London,Chicken and Pig Pie,Languages of Love Wedding Cake
4,10,Ruby,20,2,Runner-up,History of Art and Philosophy Student,"Southend, Essex",Picnic Basket Pie,"Raspberry, Lemon and Passion Fruit Wedding Cake"
4,10,Frances,31,3,WINNER,Children's Clothes Designer,"Market Harborough, Leicestershire",Rainbow Picnic Pie,Midsummer Night's Dream Wedding Cake
5,1,Chetna,35,3,IN,Fashion Designer,"Broadstairs, Kent","Cardamom, Pistachio and Coffee Swiss Roll",Tiered Victoria Sponges with Lemon Curd and Raspberry Cream
5,1,Diana,69,5,IN,Women's Institute (WI) Judge,"Alkington, Shropshire",Mum's Sunday Tea Lemon Curd Swiss Roll,Chocolate Ganache Surprises
5,1,Enwezor,39,9,IN,Business Consultant,"Portsmouth, Hampshire",Raspberry and Lemon Swiss Roll,Coffee and Walnut Battenberg Squares
5,1,Iain,31,4,IN,Construction Engineer,London/Belfast,Apricot and Basil Swiss Roll with Mascarpone and White Chocolate Cream,"Lemon Drizzle Cakes with Mascarpone Filling, Drizzled Icing, and Candied Lemon"
5,1,Jordan,32,12,IN,IT Manager,"Sneinton, Nottingham",Kawaii Frasier Swiss Roll,Lemon Drizzle Cakes with Blueberry and Lemon Curd
5,1,Kate,41,6,IN,Furniture Restorer,"Brighton, East Sussex",Red Velvet and White Chocolate Swiss Roll,Mini Tiered Victoria Sponges
5,1,Luis,42,7,IN,Graphic Designer,"Poynton, Cheshire",Spanish Swiss Roll,Raspberry and Lemon Genoise Slices with Lemon Drizzles
5,1,Martha,17,2,IN,Student,"Ascot, Berkshire",Tiramisu Swiss Roll,Mini Lemon and Thyme Drizzle Cakes
5,1,Norman,66,11,IN,Retired Naval Officer,"Portknockie, Moray",Black Forest Swiss Roll,Almond and Raspberry Mini Cakes
5,1,Richard,38,10,IN,Builder,"Mill Hill, London",Pistachio and Strawberry Swiss Roll,Miniature Coffee & Walnut Cakes
5,1,Claire,31,8,OUT,Speech Therapist,"Ashton upon Mersey, Trafford",Chocolatey Orangey Swirly Roll,Mini Chocolate and Cherry Cakes
5,1,Nancy,60,1,STAR BAKER,Retired Practice Manager,"Barton-upon-Humber, Lincolnshire",Coffee and Hazelnut Swiss Roll,Jaffa Orange Cakes
5,2,Chetna,35,8,IN,Fashion Designer,"Broadstairs, Kent",Fenugreek and Carom Crackers,Day On The Beach
5,2,Diana,69,7,IN,Women's Institute (WI) Judge,"Alkington, Shropshire",Parmesan Triangles,"Express, First Class"
5,2,Iain,31,11,IN,Construction Engineer,London/Belfast,Za'atar and Fig Biscuits,Wild West Scene
5,2,Jordan,32,6,IN,IT Manager,"Sneinton, Nottingham","Sourdough, Parmesan and Chilli Biscuits",Monster Attack
5,2,Kate,41,4,IN,Furniture Restorer,"Brighton, East Sussex",Parmesan and Apple Biscuits,Tea Time
5,2,Luis,42,3,IN,Graphic Designer,"Poynton, Cheshire",Black Olive and Rosemary Biscuits with Caramelised Onion Glaze,George Versus The Dragon
5,2,Martha,17,5,IN,Student,"Ascot, Berkshire",Caramelised Onion and Goat's Cheese Sandwich Biscuits,Ski Village Scene
5,2,Nancy,60,2,IN,Retired Practice Manager,"Barton-upon-Humber, Lincolnshire",Fennel and Rye Thins,Hansel and Gretel Scene
5,2,Norman,66,10,IN,Retired Naval Officer,"Portknockie, Moray",Farthing Biscuits,Zulu Boats at Dawn
5,2,Enwezor,39,9,OUT,Business Consultant,"Portsmouth, Hampshire",Pumpkin and Sunflower Savoury Biscuits,Space Adventure Moon Scene
5,2,Richard,38,1,STAR BAKER,Builder,"Mill Hill, London",Rosemary Seeded Crackers,Pirates!
5,3,Chetna,35,8,IN,Fashion Designer,"Broadstairs, Kent",Onion and Pine Nut Rolls,Rolled and Filled Twin Loaf
5,3,Diana,69,7,IN,Women's Institute (WI) Judge,"Alkington, Shropshire",Rustic Picnic Rolls,Sharing Savoury Pinwheel
5,3,Iain,31,9,IN,Construction Engineer,London/Belfast,Cranberry and Walnut Rye Bread Rolls,Moroccan Plaited with a Bessara Dip
5,3,Kate,41,1,IN,Furniture Restorer,"Brighton, East Sussex",Orange and Cardamom Rye Bread Knots,"Prosciutto, Olive and Coriander Bread"
5,3,Martha,17,3,IN,Student,"Ascot, Berkshire",Date and Walnut Rye Rolls,Stuffed Sunflower Loaf
5,3,Nancy,60,5,IN,Retired Practice Manager,"Barton-upon-Humber, Lincolnshire",Cider and Walnut Crusty Rolls,'Full English' Stromboli
5,3,Norman,66,4,IN,Retired Naval Officer,"Portknockie, Moray",Rye Bread Rolls,Chicken and Roasted Vegetable Picnic Loaf
5,3,Richard,38,6,IN,Builder,"Mill Hill, London",Rye and Cranberry Rolls,Pesto Pinwheel
5,3,Jordan,32,10,OUT,IT Manager,"Sneinton, Nottingham",Rye and Spelt Bread Rolls,Strawberry Raspberry Cheesecake Brioche
5,3,Luis,42,2,STAR BAKER,Graphic Designer,"Poynton, Cheshire",Opposites Attract Rolls,Roscón de Reyes
5,4,Chetna,35,3,IN,Fashion Designer,"Broadstairs, Kent","Rhubarb, Strawberry and Orange Puddings","Mango, Raspberry and Coconut Baked Alaska"
5,4,Diana,69,9,IN,Women's Institute (WI) Judge,"Alkington, Shropshire",Orange and Lemon Curd Pots,Raspberry Ripple Alaska Swan
5,4,Kate,41,7,IN,Furniture Restorer,"Brighton, East Sussex",Chocolate and Salted Caramel Molten Puddings,"Pistachio, Raspberry and Chocolate Baked Alaska"
5,4,Luis,42,2,IN,Graphic Designer,"Poynton, Cheshire",Pears in Puddings,Bakewell Alaska
5,4,Martha,17,1,IN,Student,"Ascot, Berkshire",Peanut Butter Chocolate Fondants,Key Lime Baked Alaska
5,4,Nancy,60,4,IN,Retired Practice Manager,"Barton-upon-Humber, Lincolnshire",Pistachio Puddings with Chocolate Sauce,Summer Pudding Alaska
5,4,Norman,66,8,IN,Retired Naval Officer,"Portknockie, Moray",Mini Sticky Toffee Puddings,Baked Alaska with Strawberry Surprise
5,4,Iain,31,6,OUT,Construction Engineer,London/Belfast,"Chocolate, Lime and Raspberry Fondants","Chocolate, Black Sesame Seed and Coffee Caramel Baked Alaska (not presented)"
5,4,Richard,38,5,STAR BAKER,Builder,"Mill Hill, London",Black Forest Chocolate Fondants,Tiramisu Baked Alaska
5,5,Chetna,35,2,IN,Fashion Designer,"Broadstairs, Kent",Rice Custard Tart with Mangoes and Raspberries,Fusion Tiered Pies
5,5,Luis,42,6,IN,Graphic Designer,"Poynton, Cheshire",Tropical Manchester Tart,Four Fruity Seasons Tower
5,5,Martha,17,1,IN,Student,"Ascot, Berkshire","Pistachio, Apricot and Honey Custard Tart",Three Little Pigs Pie
5,5,Nancy,60,4,IN,Retired Practice Manager,"Barton-upon-Humber, Lincolnshire",Chocolate Crusted Passion Fruit Tart,Trio of Apple Pies
5,5,Richard,38,7,IN,Builder,"Mill Hill, London",Fig and Orange Tart,Three Course Autumn Pie Feast
5,5,Norman,66,5,OUT,Retired Naval Officer,"Portknockie, Moray",Tarte au Citron,Pieful Tower
5,5,Kate,41,3,STAR BAKER,Furniture Restorer,"Brighton, East Sussex",Rhubarb and Custard Tart,"Rhubarb, Prune and Apple Pies"
5,6,Kate,41,6,IN,Furniture Restorer,"Brighton, East Sussex","Pecan, Chocolate and Sour Cherry Yeast Cake",Trio of Dobos Tortes
5,6,Luis,42,3,IN,Graphic Designer,"Poynton, Cheshire",Apple and Cinnamon Kugelhopf with Honeyed Apples,The Cage on the Rocky Hill
5,6,Martha,17,4,IN,Student,"Ascot, Berkshire",Dark Chocolate and Almond Liqueur Savarin,Chess-Themed Chocolate and Salted Caramel Dobos Torte
5,6,Nancy,60,1,IN,Retired Practice Manager,"Barton-upon-Humber, Lincolnshire",Rum Punch Savarin with Coconut Cream and Tropical Fruits,Chocolate and Caramel Dobos Torte
5,6,Richard,38,5,IN,Builder,"Mill Hill, London",Fruity Guglhupf with an Orange Glaze,Sugar Forest Dobos Torte
5,6,Chetna,35,2,STAR BAKER,Fashion Designer,"Broadstairs, Kent",Orange Savarin with Cinnamon Cream,Almond Liqueur Dobos Torte with Chocolate Caramel Buttercream
5,7,Chetna,35,6,IN,Fashion Designer,"Broadstairs, Kent",Crispy Lentil Kachori,Chocolate and Mango & Lemon Meringue Éclairs
5,7,Luis,42,5,IN,Graphic Designer,"Poynton, Cheshire",Childhood Empanadas,"Stars and Stripes Éclairs
(Blueberry Cheesecake & Peanut Butter and Jelly Éclairs)"
5,7,Martha,17,3,IN,Student,"Ascot, Berkshire",Mini Beef Wellingtons,Rhubarb and Custard & Maple Syrup and Bacon Éclairs
5,7,Nancy,60,2,IN,Retired Practice Manager,"Barton-upon-Humber, Lincolnshire",Spicy Duck Pasties,Smoked Salmon and Horseradish & Raspberry Ripple Éclairs
5,7,Kate,41,4,OUT,Furniture Restorer,"Brighton, East Sussex",Spinach and Paneer Spicy Samosa,Neapolitan & Lemon Meringue Éclairs
5,7,Richard,38,1,STAR BAKER,Builder,"Mill Hill, London",Minted Lamb Pasties,"Stair of Éclairs
(Lavender and Blueberry & Rose and Raspberry Éclairs)"
5,8,Chetna,35,1,IN,Fashion Designer,"Broadstairs, Kent",Date and Walnut Swirl Bread,Chocolate Mousse Filled DoughnutsBraided Doughnuts
5,8,Luis,42,2,IN,Graphic Designer,"Poynton, Cheshire",Black Forest Cherry Tree,"Cocktail Doughnuts
(Mudslide & Raspberry Mojito)"
5,8,Nancy,60,3,IN,Retired Practice Manager,"Barton-upon-Humber, Lincolnshire",Lincolnshire Plum Braid,"Doughnut Family Tree
(Limoncello and Almond & Milk Chocolate and Orange)"
5,8,Martha,17,5,OUT,Student,"Ascot, Berkshire",Spiced Plum Iced Bread Swirl,Glazed Lemon & Poppy Seed DoughnutsChocolate & Passion Fruit Doughnuts
5,8,Richard,38,4,STAR BAKER,Builder,"Mill Hill, London",Fruit Swedish Tea Ring,Rhubarb and Custard and Toffee Apple Doughnuts
5,9,Luis,42,1,IN,Graphic Designer,"Poynton, Cheshire",Indian Rose BaklavaHalwa Baklava Rolls,"Chocolate Mousse & Cherry EntremetsPomegranate, Fig & Pistachio Sponges"
5,9,Nancy,60,3,IN,Retired Practice Manager,"Barton-upon-Humber, Lincolnshire",Coffee and Chocolate BaklavaBreakfast Baklava,Raspberry NonnettesLime and Passion Fruit Entremets
5,9,Chetna,35,4,OUT,Fashion Designer,"Broadstairs, Kent",Chocolate Orange Baklava Masala Chai Baklava,"Chocolate, Orange & Nut EntremetsCappuccino Entremets"
5,9,Richard,38,2,STAR BAKER,Builder,"Mill Hill, London",Rose and Pistachio BaklavaWalnut and Almond Baklava,Hazelnut Mocha EntremetsPink Grapefruit Entremets
5,10,Luis,42,2,Runner-up,Graphic Designer,"Poynton, Cheshire","Apple, Walnut, Raisin and Cheshire Cheese ChaussonsPain au Chocolat Blanc with Raspberries and Cream Cheese",Village in Chocolate
5,10,Richard,38,3,Runner-up,Builder,"Mill Hill, London",Pear Pain au ChocolatPain Au Lait,Mill on the Hill
5,10,Nancy,60,1,WINNER,Retired Practice Manager,"Barton-upon-Humber, Lincolnshire",Apple and Lemon KitesRaspberry and Almond Croissants,Red Windmill
6,1,Alvin,37,2,IN,Nurse,"Bracknell, Berkshire",Orange Vanilla and Fig Madeira Cake,Black Forest Gâteau
6,1,Dorret,53,5,IN,Accountant,"Penwortham, Lancashire",Madeira Cake with Candied Lemons,Enchanted Forest Gâteau
6,1,Flora,19,6,IN,Art gallery assistant,"Dunkeld, Perth and Kinross",Blood Orange Madeira Cake,Black Forest Gâteau
6,1,Ian,41,8,IN,Travel photographer,"Great Wilbraham, Cambridgeshire",Somewhere West of Madeira Cake,Black Forest Cherry Tree
6,1,Mat,37,7,IN,Fire fighter,London,Gin and Tonic Madeira Cake,Black Forest Gateau
6,1,Nadiya,30,12,IN,Full-time mother,Leeds / Luton,Orange and Green Cardamom Madeira Cake,Quadruple Chocolate Black Forest Gâteau
6,1,Paul,49,10,IN,Prison governor,"Swansea, Wales","Lemon, Ginger and Caraway Seed Madeira Cake",Black Forest Chocolate Creation
6,1,Sandy,49,9,IN,Child welfare officer,"Yeadon, West Yorkshire",Madeira Cake with Almond Liqueur and Chopped Apricots,Black Forest Gâteau
6,1,Tamal,29,4,IN,Trainee anaesthetist,Manchester,Pistachio and Rose Madeira Cake,Black Forest Gâteau in a Chocolate Shell
6,1,Ugnė,32,1,IN,PA and administrator,"Woodford, London / Vilkaviškis, Lithuania",Lemon and Thyme Madeira Cake,Falling Cup Gâteau
6,1,Stu,35,11,OUT,Professional musician,"Guildford, Surrey",Marley Madeira Cake,Purple Forest Gâteau
6,1,Marie,66,3,STAR BAKER,Retired,"Auchterarder, Perthshire",Zingy Citrus Madeira Cake,A Walk in the Black Forest
6,2,Alvin,37,6,IN,Nurse,"Bracknell, Berkshire","Jackfruit, Pistachio and Macadamia Biscotti",Gingerbread Box filled with Brandy Snaps
6,2,Dorret,53,1,IN,Accountant,"Penwortham, Lancashire",Almond and Apricot Biscotti with Amber Sugar Crystals,Box of Frogs
6,2,Flora,19,2,IN,Art gallery assistant,"Dunkeld, Perth and Kinross",Wedding Biscotti,Honey and Earl Grey Tea Box
6,2,Mat,37,5,IN,Fire fighter,London,"Pistachio, Cranberry and White Chocolate Biscotti",Gingerbread Fire Engine
6,2,Nadiya,30,9,IN,Full-time mother,Leeds / Luton,"Coconut, Fennel and Pistachio Biscotti",Box of Fortunes
6,2,Paul,49,10,IN,Prison governor,"Swansea, Wales","Chocolate, Hazelnut and Fig Biscotti",Memory Box
6,2,Sandy,49,4,IN,Child welfare officer,"Yeadon, West Yorkshire",Chocolate Chunk and Hazelnut Biscotti,Sundried Tomato Cheese Biscuit Box
6,2,Tamal,29,8,IN,Trainee anaesthetist,Manchester,"Cinnamon, Maple and Cranberry Biscotti",Chessboard Box
6,2,Ugnė,32,7,IN,PA and administrator,"Woodford, London / Vilkaviškis, Lithuania",White Wine Biscotti,Baby Climbing into the Cookie Box
6,2,Marie,66,11,OUT,Retired,"Auchterarder, Perthshire",Biscotti Italiano,Russian Box
6,2,Ian,41,3,STAR BAKER,Travel photographer,"Great Wilbraham, Cambridgeshire","Orange, Rosemary and Almond Biscotti",Sandwich de la Confiture
6,3,Alvin,37,4,IN,Nurse,"Bracknell, Berkshire","Prosciutto, Manchego and Balsamic Onion Soda Breads",Cornucopia
6,3,Flora,19,2,IN,Art gallery assistant,"Dunkeld, Perth and Kinross",Fig and Hazelnut Rye Breads,Herb Couture
6,3,Mat,37,8,IN,Fire fighter,London,"Jalapeño, Mexican Cheddar and Smoked Salt Soda Breads",Curry Inspired Brighton Pavilion
6,3,Nadiya,30,9,IN,Full-time mother,Leeds / Luton,Mexican Bread with Warm Tomato Salsa,Snake Charmer's Basket
6,3,Paul,49,10,IN,Prison governor,"Swansea, Wales",Cranberry and Orange Sweet Soda Breads,King of the Jungle
6,3,Sandy,49,7,IN,Child welfare officer,"Yeadon, West Yorkshire",Soda Breads with Smoked Bacon and Onion,Basket of Bread Flowers with a Walnut and Blue Cheese Centre
6,3,Tamal,29,3,IN,Trainee anaesthetist,Manchester,"Fig, Cheese and Walnut Breads",Breadcycle
6,3,Ugnė,32,5,IN,PA and administrator,"Woodford, London / Vilkaviškis, Lithuania",Chocolate Quick Breads with Salted Caramel Sauce,Easter Basket
6,3,Dorret,53,6,OUT,Accountant,"Penwortham, Lancashire",Walnut and Stilton Soda Breads,Unmade Bread
6,3,Ian,41,1,STAR BAKER,Travel photographer,"Great Wilbraham, Cambridgeshire",Wild Garlic Pesto Soda Breads,Flour Power
6,4,Alvin,37,9,IN,Nurse,"Bracknell, Berkshire",Blackberry Crème Brûlées,Tower of Fruits Cheesecakes
6,4,Flora,19,3,IN,Art gallery assistant,"Dunkeld, Perth and Kinross",Rhubarb and Ginger Crème Brûlées,Elderflower and Granola Cheesecakes
6,4,Mat,37,7,IN,Fire fighter,London,Coconut Crème Brûlées,Chocolate Bar Cheesecakes
6,4,Nadiya,30,8,IN,Full-time mother,Leeds / Luton,Cinnamon Tea Crème Brûlées,Fizzy Pop Cheesecakes
6,4,Paul,49,1,IN,Prison governor,"Swansea, Wales",Almond Crème Brûlées,Berry Cheesecake Tower
6,4,Tamal,29,5,IN,Trainee anaesthetist,Manchester,Rhubarb and Ginger Crème Brûlées,"Mango, Hazelnut and Rosemary Cheesecake Trio"
6,4,Ugnė,32,2,IN,PA and administrator,"Woodford, London / Vilkaviškis, Lithuania",Marula Fruit and Coffee Liqueur Crème Brûlées,"Lime, Coconut and Hazelnut Cheesecakes"
6,4,Sandy,49,6,OUT,Child welfare officer,"Yeadon, West Yorkshire",Pontefract Crème Brûlées,"Cassata, Whisky and Orange & Apple Pie Cheesecakes"
6,4,Ian,41,4,STAR BAKER,Travel photographer,"Great Wilbraham, Cambridgeshire",Pomegranate Two Ways Crème Brûlées,Trio of Spicy and Herby Baked Cheesecakes
6,5,Alvin,37,8,IN,Nurse,"Bracknell, Berkshire",Pineapple Upside Down Cake,"Buko Pandan, Mango and Passion Fruit Ice Cream Roll"
6,5,Flora,19,3,IN,Art gallery assistant,"Dunkeld, Perth and Kinross","Pistachio, Apple and Cardamom Madeleine Cake",Chocolate and Pear Bûche
6,5,Ian,41,5,IN,Travel photographer,"Great Wilbraham, Cambridgeshire",Honey and Flowers Cake,Dessert Island
6,5,Mat,37,4,IN,Fire fighter,London,Sugar Free Carrot Cake,Raspberry and Coconut Ice Cream Roll
6,5,Paul,49,2,IN,Prison governor,"Swansea, Wales",Carrot & Pecan Cake,Dessert Island Getaway
6,5,Tamal,29,7,IN,Trainee anaesthetist,Manchester,Honey and Grapefruit Polenta Cake,Passion Fruit and Pineapple Ice Cream Roll
6,5,Ugnė,32,6,OUT,PA and administrator,"Woodford, London / Vilkaviškis, Lithuania",Chocolate and Hazelnut Sugar-Free Cake,"Chocolate, Peanut Butter and Grape Jam Roll"
6,5,Nadiya,30,1,STAR BAKER,Full-time mother,Leeds / Luton,Naked Blueberry and Caraway Crunch Cake,Chocolate and Strawberry Lime Ice Cream Roll
6,6,Flora,19,2,IN,Art gallery assistant,"Dunkeld, Perth and Kinross",Apricot and Rosemary Frangipane Tart,Asparagus and Parma Ham and Praline and Chocolate Vol-au-vents
6,6,Ian,41,3,IN,Travel photographer,"Great Wilbraham, Cambridgeshire",Pear and Raspberry Frangipane Tart,vol-au-vents Terre et Mer
6,6,Nadiya,30,4,IN,Full-time mother,Leeds / Luton,"Bay Leaf, Rong Tea and Pear Tart",Bengali Korma and Clementine with Cod Vol-au-vents
6,6,Paul,49,5,IN,Prison governor,"Swansea, Wales",Christmas Frangipane Tart,Savoury and Sweet Bouchées
6,6,Tamal,29,7,IN,Trainee anaesthetist,Manchester,Spiced Pear Frangipane Tart,Fennel and Rosemary Pulled Pork and Chicken and Coriander vol-au-vents
6,6,Alvin,37,6,OUT,Nurse,"Bracknell, Berkshire",Plum Frangipane Tart,Smoked Salmon En Croûte and Vermouth Chicken à la King Vol-au-vents
6,6,Mat,37,1,STAR BAKER,Fire fighter,London,Piña Colada Frangipane Tart,His 'n' Hers Vol-au-vents
6,7,Flora,19,4,IN,Art gallery assistant,"Dunkeld, Perth and Kinross",Game Pie with Shallot and Apple Chutney,"Raspberry, Pomegranate and Champagne Charlotte Russe"
6,7,Ian,41,5,IN,Travel photographer,"Great Wilbraham, Cambridgeshire",Roadkill Pie,Victoria's Crown Charlotte Russe
6,7,Nadiya,30,1,IN,Full-time mother,Leeds / Luton,Aromatic Raised Game Pie,Mango and Raspberry Charlotte Russe
6,7,Paul,49,2,IN,Prison governor,"Swansea, Wales",Not a Boaring Pie,Charlotte Rose
6,7,Mat,37,6,OUT,Fire fighter,London,Raised Venison and Pigeon Pie,Strawberry Charlotte Russe
6,7,Tamal,29,3,STAR BAKER,Trainee anaesthetist,Manchester,Middle Eastern Game Pie,"Spiced Blackberry, Raspberry and Cardamom Charlotte Russe"
6,8,Flora,19,3,IN,Art gallery assistant,"Dunkeld, Perth and Kinross",Peach & Lemon Thyme and Smoked Almond & Butterscotch Cream Horns,Lime & Basil and Coconut & White Chocolate Religieuse à l'ancienne
6,8,Ian,41,2,IN,Travel photographer,"Great Wilbraham, Cambridgeshire",Mont Blanc & Black Forest Gâteau Horns,Nun with Hidden Passions
6,8,Tamal,29,4,IN,Trainee anaesthetist,Manchester,Lime & Mascarpone and Malt Cream Horns,Passionfruit & Mango and Pistachio & Raspberry Religieuse à l'ancienne
6,8,Paul,49,5,OUT,Prison governor,"Swansea, Wales",Café Tipple & Banana Crunch-away Horns,Religieuse à l'ancienne
6,8,Nadiya,30,1,STAR BAKER,Full-time mother,Leeds / Luton,Rose Pistachio and Mocha Hazelnut Horns,Bubble Gum and Peppermint Cream Religieuse à l'ancienne
